{
    "packageName": "com.thebancast.Love",
    "title": "LOVE",
    "description": "A classically styled platformer with a focus on difficult yet-not-unfair gameplay, a clever respawn mechanic, and a smooth soundtrack.",
    "players": [
        1
    ],
    "genres": [
        "Adventure",
        "Arcade/Pinball",
        "Platformer",
        "Retro"
    ],
    "releases": [
        {
            "name": "0.1.8",
            "versionCode": 0,
            "uuid": "020bb61b-5e10-44d2-95e7-03ae8dd4336a",
            "date": "2013-07-23T16:20:07Z",
            "url": "https://archive.org/download/ouya_com.thebancast.Love_0.1.8/Love_0.1.8_com.thebancast.Love.apk",
            "size": 29618939,
            "md5sum": "8089a491a7e3a705f45f652eba480d2a",
            "publicSize": 0,
            "nativeSize": 0,
            "cert_fingerprint": "61:90:04:A4:2F:95:16:C4:E9:29:BC:50:71:5D:84:84:F7:33:08:11:81:29:94:81:B7:3B:57:1D:C8:D9:B3:67",
            "cert_subject": "C = GB, L = Auchtermuchty, O = Acme Ltd., OU = Development, CN = Privateer"
        }
    ],
    "discover": "http://ouya.cweiske.de/game-images/com.thebancast.Love/discover",
    "media": [
        {
            "type": "image",
            "url": "https://archive.org/download/ouya_com.thebancast.Love_0.1.8/yM7ob4AFSP6iGxF3lvVO.jpg",
            "thumb": "https://archive.org/download/ouya_com.thebancast.Love_0.1.8/yM7ob4AFSP6iGxF3lvVO_thumb.jpg"
        },
        {
            "type": "image",
            "url": "https://archive.org/download/ouya_com.thebancast.Love_0.1.8/6RppJFUSGuxFoycukEx4.jpg",
            "thumb": "https://archive.org/download/ouya_com.thebancast.Love_0.1.8/6RppJFUSGuxFoycukEx4_thumb.jpg"
        },
        {
            "type": "image",
            "url": "https://archive.org/download/ouya_com.thebancast.Love_0.1.8/C70U1HdvQrOmKBUIw4sA.jpg",
            "thumb": "https://archive.org/download/ouya_com.thebancast.Love_0.1.8/C70U1HdvQrOmKBUIw4sA_thumb.jpg"
        }
    ],
    "developer": {
        "uuid": "11111111-88c5-4079-8017-bc5d42e653c3",
        "name": "Fred Wood",
        "supportEmail": "thatsmytrunks@gmail.com",
        "supportPhone": null,
        "founder": true
    },
    "contentRating": "Everyone",
    "website": "http://Love-The-Game.com/",
    "firstPublishedAt": "2013-07-23T16:20:07Z",
    "inAppPurchases": false,
    "overview": "Released in July 2013 by Fred Wood.",
    "premium": false,
    "rating": {
        "likeCount": 223,
        "average": 4.21,
        "count": 140
    }
}
