{
    "packageName": "com.pigoutproductions.hiddengardenfantasy",
    "title": "Hidden Garden Fantasy",
    "description": "Hidden Garden is back with even more beautiful scenes and more amazing music. Continue your journey through the Hidden Gardens in this beautiful hidden object adventure game. Hidden Garden Fantasy is the next title in the Hidden Garden series. Relax and enjoy the gorgeous scenery as you find hundreds of butterflies, birds, lady bugs, and honey bees throughout many breathtaking locations. The stunning visuals are accompanied by four new equally stunning musical compositions.",
    "players": [
        1
    ],
    "genres": [
        "Meditative",
        "Puzzle/Trivia",
        "Short on Time?"
    ],
    "releases": [
        {
            "name": "1.1",
            "versionCode": 2,
            "uuid": "1b16f07e-16fa-4df3-a623-c8bfc2c7d3d5",
            "date": "2014-07-10T21:22:36Z",
            "url": "https://archive.org/download/ouya_com.pigoutproductions.hiddengardenfantasy_1.1/Hidden%20Garden%20Fantasy_1.1_com.pigoutproductions.hiddengardenfantasy.apk",
            "size": 37986416,
            "md5sum": "659f6b75f52c3a2aee10dab2ba59c5ba",
            "publicSize": 291034,
            "nativeSize": 14689140,
            "cert_fingerprint": "95:C4:71:8A:6A:B2:4B:A6:79:EE:4E:0C:5C:A3:40:D9:C8:D0:DE:0C:3D:18:AF:A2:50:DE:AC:41:2E:FE:E5:DF",
            "cert_subject": "C = US, ST = mo, L = houston, O = pigoutproductions, OU = pigoutproductions, CN = William Garrett"
        }
    ],
    "discover": "http://ouya.cweiske.de/game-images/com.pigoutproductions.hiddengardenfantasy/discover",
    "media": [
        {
            "type": "video",
            "url": "https://vimeo.com/100833853"
        },
        {
            "type": "image",
            "url": "http://ouya.cweiske.de/game-images/com.pigoutproductions.hiddengardenfantasy/detail-1",
            "thumb": "http://ouya.cweiske.de/game-images/com.pigoutproductions.hiddengardenfantasy/detail-1-thumb"
        },
        {
            "type": "image",
            "url": "http://ouya.cweiske.de/game-images/com.pigoutproductions.hiddengardenfantasy/detail-2",
            "thumb": "http://ouya.cweiske.de/game-images/com.pigoutproductions.hiddengardenfantasy/detail-2-thumb"
        },
        {
            "type": "image",
            "url": "http://ouya.cweiske.de/game-images/com.pigoutproductions.hiddengardenfantasy/detail-3",
            "thumb": "http://ouya.cweiske.de/game-images/com.pigoutproductions.hiddengardenfantasy/detail-3-thumb"
        },
        {
            "type": "image",
            "url": "http://ouya.cweiske.de/game-images/com.pigoutproductions.hiddengardenfantasy/detail-4",
            "thumb": "http://ouya.cweiske.de/game-images/com.pigoutproductions.hiddengardenfantasy/detail-4-thumb"
        }
    ],
    "developer": {
        "uuid": "9e40eed8-a159-449e-bc76-da5d13bc1e64",
        "name": "Pig Out Productions, LLC",
        "supportEmail": "support@pigoutproductions.com",
        "supportPhone": null,
        "founder": false
    },
    "contentRating": "Everyone",
    "website": "http://www.pigoutproductions.com",
    "firstPublishedAt": "2014-07-09T22:06:17Z",
    "inAppPurchases": false,
    "overview": "Released in July 2014 by Pig Out Productions, LLC.",
    "premium": true,
    "rating": {
        "likeCount": 0,
        "average": 5,
        "count": 3
    },
    "products": [
        {
            "promoted": true,
            "identifier": "HGFantasy_Full",
            "name": "Hidden Garden Fantasy",
            "description": "Begin your journey through the Hidden Gardens?",
            "localPrice": 1.99,
            "originalPrice": 1.99,
            "currency": "USD"
        }
    ]
}
