{
    "packageName": "com.kwnetzwelt.Marbelous",
    "title": "Marbelous!",
    "description": "In Marbelous! you roll, jump and bounce through more than 35 levels in 6 episodes, each with a unique retro game reference. It is completely free, exclusively on ouya.",
    "players": [
        1
    ],
    "genres": [
        "Adventure",
        "Arcade/Pinball"
    ],
    "releases": [
        {
            "name": "1.2.0",
            "versionCode": 0,
            "uuid": "9da6d654-41fc-4a82-92c6-9114d7b7893f",
            "date": "2013-12-03T07:00:26Z",
            "url": "https://archive.org/download/ouya_com.kwnetzwelt.Marbelous_1.2.0/Marbelous%21_1.2.0_com.kwnetzwelt.Marbelous.apk",
            "size": 41906120,
            "md5sum": "66d99185cb8500b43acf3822df701b66",
            "publicSize": 0,
            "nativeSize": 0,
            "cert_fingerprint": "10:EA:35:17:5B:1F:5A:C6:9E:31:84:DA:DD:2E:B5:A3:0E:1B:F8:CF:B5:6B:5E:74:70:06:67:96:71:B2:4C:3D",
            "cert_subject": "C = de, ST = nrw, L = ob, O = kwnetzwelt, CN = Kai Wegner"
        }
    ],
    "discover": "http://ouya.cweiske.de/game-images/com.kwnetzwelt.Marbelous/discover",
    "media": [
        {
            "type": "video",
            "url": "https://vimeo.com/80252055"
        },
        {
            "type": "image",
            "url": "http://ouya.cweiske.de/game-images/com.kwnetzwelt.Marbelous/screenshot-1",
            "thumb": "http://ouya.cweiske.de/game-images/com.kwnetzwelt.Marbelous/screenshot-1-thumb"
        },
        {
            "type": "image",
            "url": "http://ouya.cweiske.de/game-images/com.kwnetzwelt.Marbelous/screenshot-2",
            "thumb": "http://ouya.cweiske.de/game-images/com.kwnetzwelt.Marbelous/screenshot-2-thumb"
        },
        {
            "type": "image",
            "url": "http://ouya.cweiske.de/game-images/com.kwnetzwelt.Marbelous/screenshot-3",
            "thumb": "http://ouya.cweiske.de/game-images/com.kwnetzwelt.Marbelous/screenshot-3-thumb"
        },
        {
            "type": "image",
            "url": "http://ouya.cweiske.de/game-images/com.kwnetzwelt.Marbelous/screenshot-4",
            "thumb": "http://ouya.cweiske.de/game-images/com.kwnetzwelt.Marbelous/screenshot-4-thumb"
        },
        {
            "type": "image",
            "url": "http://ouya.cweiske.de/game-images/com.kwnetzwelt.Marbelous/screenshot-5",
            "thumb": "http://ouya.cweiske.de/game-images/com.kwnetzwelt.Marbelous/screenshot-5-thumb"
        },
        {
            "type": "image",
            "url": "http://ouya.cweiske.de/game-images/com.kwnetzwelt.Marbelous/screenshot-6",
            "thumb": "http://ouya.cweiske.de/game-images/com.kwnetzwelt.Marbelous/screenshot-6-thumb"
        },
        {
            "type": "image",
            "url": "http://ouya.cweiske.de/game-images/com.kwnetzwelt.Marbelous/screenshot-7",
            "thumb": "http://ouya.cweiske.de/game-images/com.kwnetzwelt.Marbelous/screenshot-7-thumb"
        }
    ],
    "developer": {
        "uuid": "79e6a138-2a96-46fc-bea3-0e6cf6ba3af5",
        "name": "Alluring Elements",
        "supportEmail": "kwnetzwelt@gmail.com",
        "supportPhone": null,
        "founder": false
    },
    "contentRating": "Everyone",
    "website": "http://www.marbelousgame.com",
    "firstPublishedAt": "2013-12-03T07:00:26Z",
    "inAppPurchases": false,
    "overview": "Released in December 2013 by Alluring Elements.",
    "premium": false,
    "rating": {
        "likeCount": 78,
        "average": 4.04,
        "count": 171
    }
}
