{
    "packageName": "com.idriscelik.excavatorsimulatorpro",
    "title": "Excavator Simulator PRO",
    "description": "You can use excavator with this game. Digging, Breaking, Cutting. Destroy builds, load to dump truck. You can use 3 different attachment; Bucket, Rock Breaker and scissors",
    "players": [
        1
    ],
    "genres": [
        "Puzzle/Trivia",
        "Sim/Strategy"
    ],
    "releases": [
        {
            "name": "1.0",
            "versionCode": 0,
            "uuid": "45426ba2-6ed8-46ad-8c89-4ff3fc056b01",
            "date": "2014-08-18T17:59:24Z",
            "url": "https://archive.org/download/ouya_com.idriscelik.excavatorsimulatorpro_1.0/Excavator%20Simulator_1.0_com.idriscelik.excavatorsimulatorpro.apk",
            "size": 65874667,
            "md5sum": "1f7e4971c1fd6118119af9e7d513b59c",
            "publicSize": 168261,
            "nativeSize": 14769772,
            "cert_fingerprint": "F5:C3:11:2F:EF:C2:E3:27:34:A9:58:7F:11:CD:17:4F:F9:B8:3C:0A:C0:1A:98:8F:67:5F:E3:D5:12:5F:83:62",
            "cert_subject": "CN = idris CELIK, OU = idris celik, O = idris Celik, L = istanbul, ST = Turkey, C = 90"
        }
    ],
    "discover": "http://ouya.cweiske.de/game-images/com.idriscelik.excavatorsimulatorpro/discover",
    "media": [
        {
            "type": "video",
            "url": "https://vimeo.com/103530035"
        },
        {
            "type": "image",
            "url": "http://ouya.cweiske.de/game-images/com.idriscelik.excavatorsimulatorpro/detail-1",
            "thumb": "http://ouya.cweiske.de/game-images/com.idriscelik.excavatorsimulatorpro/detail-1-thumb"
        },
        {
            "type": "image",
            "url": "http://ouya.cweiske.de/game-images/com.idriscelik.excavatorsimulatorpro/detail-2",
            "thumb": "http://ouya.cweiske.de/game-images/com.idriscelik.excavatorsimulatorpro/detail-2-thumb"
        },
        {
            "type": "image",
            "url": "http://ouya.cweiske.de/game-images/com.idriscelik.excavatorsimulatorpro/detail-3",
            "thumb": "http://ouya.cweiske.de/game-images/com.idriscelik.excavatorsimulatorpro/detail-3-thumb"
        },
        {
            "type": "image",
            "url": "http://ouya.cweiske.de/game-images/com.idriscelik.excavatorsimulatorpro/detail-4",
            "thumb": "http://ouya.cweiske.de/game-images/com.idriscelik.excavatorsimulatorpro/detail-4-thumb"
        },
        {
            "type": "image",
            "url": "http://ouya.cweiske.de/game-images/com.idriscelik.excavatorsimulatorpro/detail-5",
            "thumb": "http://ouya.cweiske.de/game-images/com.idriscelik.excavatorsimulatorpro/detail-5-thumb"
        },
        {
            "type": "image",
            "url": "http://ouya.cweiske.de/game-images/com.idriscelik.excavatorsimulatorpro/detail-6",
            "thumb": "http://ouya.cweiske.de/game-images/com.idriscelik.excavatorsimulatorpro/detail-6-thumb"
        },
        {
            "type": "image",
            "url": "http://ouya.cweiske.de/game-images/com.idriscelik.excavatorsimulatorpro/detail-7",
            "thumb": "http://ouya.cweiske.de/game-images/com.idriscelik.excavatorsimulatorpro/detail-7-thumb"
        },
        {
            "type": "image",
            "url": "http://ouya.cweiske.de/game-images/com.idriscelik.excavatorsimulatorpro/detail-8",
            "thumb": "http://ouya.cweiske.de/game-images/com.idriscelik.excavatorsimulatorpro/detail-8-thumb"
        }
    ],
    "developer": {
        "uuid": "11111111-43cf-4e8a-ab7b-41d294db7818",
        "name": "idris Celik",
        "supportEmail": "kuklainteractive@gmail.com",
        "supportPhone": null,
        "founder": false
    },
    "contentRating": "Everyone",
    "website": "http://www.idriscelik.com.tr",
    "firstPublishedAt": "2014-08-18T17:59:24Z",
    "inAppPurchases": false,
    "overview": "Released in August 2014 by idris Celik.",
    "premium": true,
    "rating": {
        "likeCount": 0,
        "average": 3.43,
        "count": 14
    },
    "products": [
        {
            "promoted": true,
            "identifier": "Excavator_Simulator",
            "name": "Excavator Simulator PRO",
            "description": "This is a Simulation + Skill game.",
            "localPrice": 0.99,
            "originalPrice": 0.99,
            "currency": "USD"
        }
    ]
}
