{
    "packageName": "com.AGameAWeek.PiTSC_I15",
    "title": "Platdude in The Spirit Collector",
    "description": "Platdude has an infestation, so has been laying out traps.\nAnnoyingly, it's not rats, or mice, or even bats.\nGhosts have invaded the mansion, so Platdude's hired out a bunch of handy ghost traps to try to catch them all.\n\nRun past a trap to trigger it off, and insert a blue power-sphere to recharge it.\nCan you protect the mansion?\nOr will Platdude be too scared!?",
    "players": [
        1
    ],
    "genres": [
        "Adventure",
        "Platformer"
    ],
    "releases": [
        {
            "name": "1.3",
            "versionCode": 0,
            "uuid": "7756e417-fbad-485b-9b2f-860b19f8fd40",
            "date": "2016-01-04T22:41:17Z",
            "url": "https://archive.org/download/ouya_com.AGameAWeek.PiTSC_I15_1.3/Collector_1.3_com.AGameAWeek.PiTSC_I15-B9B3.apk",
            "size": 7750229,
            "md5sum": "b9b395edb4b73a0602fe2259a6debea9",
            "publicSize": 157014,
            "nativeSize": 0,
            "cert_fingerprint": "A9:C6:85:6F:07:6C:9C:9F:48:DE:4E:3E:34:62:39:20:80:AF:0C:79:2D:82:C7:5E:93:BF:3E:94:7E:B3:DA:35",
            "cert_subject": "C = GB, ST = GM, L = Bolton, O = agameaweek, OU = Unknown, CN = Jayenkai"
        },
        {
            "name": "1.2",
            "versionCode": 12,
            "uuid": "2658b7b2-a4a4-4693-aa47-6c4c166e5213",
            "date": "2016-01-04T00:00:00Z",
            "url": "https://archive.org/download/ouya_com.AGameAWeek.PiTSC_I15_1.2/Collector_1.2_com.AGameAWeek.PiTSC_I15.apk",
            "size": 7740959,
            "md5sum": "53bcdf7dad8561da3e04a157a467958c",
            "cert_fingerprint": "A9:C6:85:6F:07:6C:9C:9F:48:DE:4E:3E:34:62:39:20:80:AF:0C:79:2D:82:C7:5E:93:BF:3E:94:7E:B3:DA:35",
            "cert_subject": "C = GB, ST = GM, L = Bolton, O = agameaweek, OU = Unknown, CN = Jayenkai"
        }
    ],
    "discover": "http://ouya.cweiske.de/game-images/com.AGameAWeek.PiTSC_I15/discover",
    "media": [
        {
            "type": "image",
            "url": "http://ouya.cweiske.de/game-images/com.AGameAWeek.PiTSC_I15/detail-1",
            "thumb": "http://ouya.cweiske.de/game-images/com.AGameAWeek.PiTSC_I15/detail-1-thumb"
        },
        {
            "type": "image",
            "url": "http://ouya.cweiske.de/game-images/com.AGameAWeek.PiTSC_I15/detail-2",
            "thumb": "http://ouya.cweiske.de/game-images/com.AGameAWeek.PiTSC_I15/detail-2-thumb"
        },
        {
            "type": "image",
            "url": "http://ouya.cweiske.de/game-images/com.AGameAWeek.PiTSC_I15/detail-3",
            "thumb": "http://ouya.cweiske.de/game-images/com.AGameAWeek.PiTSC_I15/detail-3-thumb"
        },
        {
            "type": "image",
            "url": "http://ouya.cweiske.de/game-images/com.AGameAWeek.PiTSC_I15/detail-4",
            "thumb": "http://ouya.cweiske.de/game-images/com.AGameAWeek.PiTSC_I15/detail-4-thumb"
        },
        {
            "type": "image",
            "url": "http://ouya.cweiske.de/game-images/com.AGameAWeek.PiTSC_I15/detail-5",
            "thumb": "http://ouya.cweiske.de/game-images/com.AGameAWeek.PiTSC_I15/detail-5-thumb"
        }
    ],
    "developer": {
        "uuid": "8a1647c2-1d78-4c08-91cf-7916e720fd67",
        "name": "Jayenkai",
        "supportEmail": null,
        "supportPhone": null,
        "founder": false
    },
    "contentRating": "Everyone",
    "website": "http://agameaweek.com",
    "firstPublishedAt": "2015-10-15T22:27:59Z",
    "inAppPurchases": false,
    "overview": "Released in January 2016 by Jayenkai.",
    "premium": false,
    "rating": {
        "likeCount": 0,
        "average": 3.33,
        "count": 9
    }
}
