{
    "packageName": "com.tributegames.Wizorb",
    "title": "Wizorb",
    "description": "The once peaceful Kingdom of Gorudo is threatened by an evil presence. The only hope for salvation is Cyrus, a wizard versed in a secret magic art called Wizorb! Explore many strange places from the derelict monster infested town of Clover to Gorudo Castle atop Cauldron Peak. Danger lurks around every corner so you'll need to keep your wits about you and have quick reflexes in order to survive.",
    "players": [
        1
    ],
    "genres": [
        "Arcade/Pinball",
        "Retro",
        "Role-Playing"
    ],
    "releases": [
        {
            "name": "1.15",
            "versionCode": 0,
            "uuid": "d22ba7fc-0365-46b7-99ee-cd6ed6ecfba7",
            "date": "2013-09-06T14:41:48Z",
            "url": "https://archive.org/download/ouya_com.tributegames.Wizorb_1.15/Wizorb_1.15_com.tributegames.Wizorb.apk",
            "size": 35316831,
            "md5sum": "847d595e887a646f7a7786cad90911dc",
            "publicSize": 0,
            "nativeSize": 0,
            "cert_fingerprint": "FE:C8:BF:8F:98:A8:DE:47:02:34:55:A1:9C:23:E9:9A:B1:D1:A7:76:89:4E:02:AB:20:69:76:4E:30:B8:6F:58",
            "cert_subject": "C = US, O = Android, CN = Android Debug"
        },
        {
            "name": "1.14",
            "versionCode": 1,
            "uuid": "44d6a492-3b9e-44ef-816e-590ef1ada0a4",
            "date": "2013-09-06T00:00:00Z",
            "url": "https://archive.org/download/ouya_com.tributegames.Wizorb_1.14/Wizorb_1.14_com.tributegames.Wizorb.apk",
            "size": 35316839,
            "md5sum": "50d6c96f48aeea0b68f4a4e33069e037",
            "cert_fingerprint": "FE:C8:BF:8F:98:A8:DE:47:02:34:55:A1:9C:23:E9:9A:B1:D1:A7:76:89:4E:02:AB:20:69:76:4E:30:B8:6F:58",
            "cert_subject": "C = US, O = Android, CN = Android Debug"
        }
    ],
    "discover": "http://ouya.cweiske.de/game-images/com.tributegames.Wizorb/discover",
    "media": [
        {
            "type": "image",
            "url": "http://ouya.cweiske.de/game-images/com.tributegames.Wizorb/screenshot-1",
            "thumb": "http://ouya.cweiske.de/game-images/com.tributegames.Wizorb/screenshot-1-thumb"
        },
        {
            "type": "image",
            "url": "http://ouya.cweiske.de/game-images/com.tributegames.Wizorb/screenshot-2",
            "thumb": "http://ouya.cweiske.de/game-images/com.tributegames.Wizorb/screenshot-2-thumb"
        },
        {
            "type": "image",
            "url": "http://ouya.cweiske.de/game-images/com.tributegames.Wizorb/screenshot-3",
            "thumb": "http://ouya.cweiske.de/game-images/com.tributegames.Wizorb/screenshot-3-thumb"
        },
        {
            "type": "image",
            "url": "http://ouya.cweiske.de/game-images/com.tributegames.Wizorb/screenshot-4",
            "thumb": "http://ouya.cweiske.de/game-images/com.tributegames.Wizorb/screenshot-4-thumb"
        }
    ],
    "developer": {
        "uuid": "6d531b35-9f5d-42f8-86c4-5c299e3d6f37",
        "name": "Tribute Games Inc.",
        "supportEmail": "info@tributegames.com",
        "supportPhone": null,
        "founder": false
    },
    "contentRating": "Everyone",
    "website": "http://wizorb.com",
    "firstPublishedAt": "2013-03-28T04:10:20Z",
    "inAppPurchases": true,
    "overview": "Released in September 2013 by Tribute Games Inc..",
    "premium": false,
    "rating": {
        "likeCount": 413,
        "average": 4.01,
        "count": 178
    },
    "products": [
        {
            "type": "entitlement",
            "promoted": true,
            "identifier": "wizorbfull",
            "name": "Unlock full game",
            "description": "",
            "localPrice": 0.01,
            "originalPrice": 0.01,
            "currency": "EUR"
        }
    ]
}
