{
    "packageName": "com.eggrollgames.matchcolorspaid",
    "title": "Kids Color and Shape Card Matching",
    "description": "Teaches color and shape recognition by combining exciting card matching game play with professional narration, fun music and positive feedback. It's fun and easy for kids to use. \r\n\r\nCOLOR IDENTIFICATION\r\n• Match colors to colors\r\n• Match colors to their name\r\n• Match two different pictures with the same color\r\n• Hear the colors as you touch them \r\n\r\nSHAPE RECOGNITION\r\n• Match shapes to shapes\r\n• Match shapes to similarly shaped items\r\n• Match two different pictures with the same shape\r\n• Hear the shapes as you touch them \r\n\r\nCHILD FRIENDLY\r\n• Peek button provides optional hints\r\n• Rewards with balloon popping and positive feedback\r\n• \"Show Me\" game keeps cards face up for easier play \r\n• Items and instructions are professionally narrated\r\n• Parental controls for sound, music and links\r\n• We do not collect personal information from our users\r\n\r\n“As parents and teachers, we believe in friction-free learning for kids of all ages. We strive to build fun experiences with eye-popping visuals, professional narration, catchy music, and lots of positive encouragement.\r\n\r\nThank you for supporting us and making our vision come to life.\r\n\r\nHave fun!!”\r\n\r\n- Blake, Mike & Amanda, Eggroll Games",
    "players": [
        1
    ],
    "genres": [
        "Kids List",
        "Puzzle/Trivia"
    ],
    "releases": [
        {
            "name": "1.0",
            "versionCode": 0,
            "uuid": "9ff201a8-3771-4790-888d-7eeb1554465d",
            "date": "2015-05-05T18:58:33Z",
            "url": "https://archive.org/download/ouya_com.eggrollgames.matchcolorspaid_1.0/Kids%20Card%20Matching%20featuring%20Colors%20and%20Shapes_1.0_com.eggrollgames.matchcolorspaid.apk",
            "size": 33528769,
            "md5sum": "3df3d0e674fe5e1d4253c132bf73055e",
            "publicSize": 1172225,
            "nativeSize": 4188488,
            "cert_fingerprint": "71:F3:0C:E6:3D:8E:01:CE:30:A6:FA:72:B2:0C:76:43:B7:73:90:3A:37:90:55:44:96:19:0A:41:37:2C:24:EF",
            "cert_subject": "C = US, ST = NC, L = Winston-Salem, O = Eggroll Games, OU = Eggroll Games, CN = Michael Oder"
        }
    ],
    "discover": "http://ouya.cweiske.de/game-images/com.eggrollgames.matchcolorspaid/discover",
    "media": [
        {
            "type": "video",
            "url": "https://vimeo.com/126131691"
        },
        {
            "type": "image",
            "url": "http://ouya.cweiske.de/game-images/com.eggrollgames.matchcolorspaid/detail-1",
            "thumb": "http://ouya.cweiske.de/game-images/com.eggrollgames.matchcolorspaid/detail-1-thumb"
        },
        {
            "type": "image",
            "url": "http://ouya.cweiske.de/game-images/com.eggrollgames.matchcolorspaid/detail-2",
            "thumb": "http://ouya.cweiske.de/game-images/com.eggrollgames.matchcolorspaid/detail-2-thumb"
        },
        {
            "type": "image",
            "url": "http://ouya.cweiske.de/game-images/com.eggrollgames.matchcolorspaid/detail-3",
            "thumb": "http://ouya.cweiske.de/game-images/com.eggrollgames.matchcolorspaid/detail-3-thumb"
        },
        {
            "type": "image",
            "url": "http://ouya.cweiske.de/game-images/com.eggrollgames.matchcolorspaid/detail-4",
            "thumb": "http://ouya.cweiske.de/game-images/com.eggrollgames.matchcolorspaid/detail-4-thumb"
        },
        {
            "type": "image",
            "url": "http://ouya.cweiske.de/game-images/com.eggrollgames.matchcolorspaid/detail-5",
            "thumb": "http://ouya.cweiske.de/game-images/com.eggrollgames.matchcolorspaid/detail-5-thumb"
        },
        {
            "type": "image",
            "url": "http://ouya.cweiske.de/game-images/com.eggrollgames.matchcolorspaid/detail-6",
            "thumb": "http://ouya.cweiske.de/game-images/com.eggrollgames.matchcolorspaid/detail-6-thumb"
        },
        {
            "type": "image",
            "url": "http://ouya.cweiske.de/game-images/com.eggrollgames.matchcolorspaid/detail-7",
            "thumb": "http://ouya.cweiske.de/game-images/com.eggrollgames.matchcolorspaid/detail-7-thumb"
        },
        {
            "type": "image",
            "url": "http://ouya.cweiske.de/game-images/com.eggrollgames.matchcolorspaid/detail-8",
            "thumb": "http://ouya.cweiske.de/game-images/com.eggrollgames.matchcolorspaid/detail-8-thumb"
        }
    ],
    "developer": {
        "uuid": "f775c8f9-d097-4dad-bf08-f70b7c66b32d",
        "name": "Eggroll Games",
        "supportEmail": null,
        "supportPhone": null,
        "founder": false
    },
    "contentRating": "Everyone",
    "website": "http://eggrollgames.com",
    "firstPublishedAt": "2015-05-05T18:58:33Z",
    "inAppPurchases": false,
    "overview": "Released in May 2015 by Eggroll Games.",
    "premium": true,
    "rating": {
        "likeCount": 0,
        "average": 5,
        "count": 1
    },
    "products": [
        {
            "promoted": true,
            "identifier": "KCSCM",
            "name": "Kids Color and Shape Card Matching",
            "description": "Teaches color and shape recognition by combining exciting card matching game play with engaging feedback.",
            "localPrice": 2.99,
            "originalPrice": 2.99,
            "currency": "USD"
        }
    ]
}
